<?xml version="1.0"?>
<TABLES xmlns:xsi="http://www.w3.org/2001/XMLSchema-instance"
        xsi:schemaLocation="pl.poznan.put.sqldatagenerator schema.xsd"
        xmlns="pl.poznan.put.sqldatagenerator">
    <TABLE>
        <NAME>RV_ENFCOMPLAINTS_DCA</NAME>
        <ROWS_NUM>1000</ROWS_NUM>
        <ATTRIBUTES>
            <ATTRIBUTE>
                <NAME>ID</NAME>
                <TYPE>INTEGER</TYPE>
                <PRIMARY_KEY>true</PRIMARY_KEY>
            </ATTRIBUTE>

            <ATTRIBUTE>
                <NAME>ENF_CSE_TYP_ID</NAME>
                <TYPE>INTEGER</TYPE>
                <MIN_VALUE>0</MIN_VALUE>
                <MAX_VALUE>100</MAX_VALUE>
            </ATTRIBUTE>

            <ATTRIBUTE>
                <NAME>ENF_REGN_ID</NAME>
                <TYPE>INTEGER</TYPE>
                <MIN_VALUE>0</MIN_VALUE>
                <MAX_VALUE>10000</MAX_VALUE>
            </ATTRIBUTE>

            <ATTRIBUTE>
                <NAME>BOARDCODE</NAME>
                <TYPE>VARCHAR</TYPE>
                <MIN_VALUE>0</MIN_VALUE>
                <MAX_VALUE>5</MAX_VALUE>
            </ATTRIBUTE>

            <ATTRIBUTE>
                <NAME>LICCODE</NAME>
                <TYPE>VARCHAR</TYPE>
                <MIN_VALUE>0</MIN_VALUE>
                <MAX_VALUE>5</MAX_VALUE>
            </ATTRIBUTE>

            <ATTRIBUTE>
                <NAME>ACTIVITYDATE</NAME>
                <TYPE>DATETIME</TYPE>
            </ATTRIBUTE>

            <ATTRIBUTE>
                <NAME>PENDINGENDDATE</NAME>
                <TYPE>DATETIME</TYPE>
            </ATTRIBUTE>

            <ATTRIBUTE>
                <NAME>ACTV_STRT_DTE</NAME>
                <TYPE>DATETIME</TYPE>
            </ATTRIBUTE>

            <ATTRIBUTE>
                <NAME>ACTV_END_DTE</NAME>
                <TYPE>DATETIME</TYPE>
            </ATTRIBUTE>

            <ATTRIBUTE>
                <NAME>CATEGORYORDER</NAME>
                <TYPE>INTEGER</TYPE>
                <MIN_VALUE>0</MIN_VALUE>
                <MAX_VALUE>150</MAX_VALUE>
            </ATTRIBUTE>

            <ATTRIBUTE>
                <NAME>ROD_REOPENDATE</NAME>
                <TYPE>DATETIME</TYPE>
            </ATTRIBUTE>

            <ATTRIBUTE>
                <NAME>ROD_CLOSEDATE</NAME>
                <TYPE>DATETIME</TYPE>
            </ATTRIBUTE>

            <ATTRIBUTE>
                <NAME>CLOSUREROWNUMBER</NAME>
                <TYPE>INTEGER</TYPE>
                <MIN_VALUE>-1000000</MIN_VALUE>
                <MAX_VALUE>1000000</MAX_VALUE>
            </ATTRIBUTE>


        </ATTRIBUTES>
    </TABLE>


</TABLES>
